Review Date,Source,Location,Address,City,State,ZIP,Star Rating,Author,URL,Feedback,Original Feedback Language (if not English),Engagement Response,reviews,Negative_Score,Neutral_Score,Positive_Score,Compound_Score,Sentiment
07/28/21,Google,80036 PARIS,3905 Lamar Avenue   -,Paris,TX,75462,1,Angela Jones,https://maps.google.com/maps?cid=14927680130682010795,Very disappointed service was terrible the manager forgot turn the keg draft beer bottle beer was Luke warm service was the worse let sat table with food drinks almost done bring drinks manager looked awful for his position,--,--,disappointed service terrible manager draft beer service bad table food drink bring drink manager awful position,0.514,0.486,0.0,-0.9136,Negative
07/28/21,Google,83056 JASPER,4223 Mannheim Road   -,Jasper,IN,47546,4,Tammy Graham,https://maps.google.com/maps?cid=11612739214779918035,The half rack ribs was removed from the two can dine menu disappointing But the food was good,--,--,half rack rib dine menu disappointing food,0.348,0.652,0.0,-0.4939,Negative
07/28/21,Google,91055 TROY,1759 West Main Street   -,Troy,OH,45373,4,Joshuah Queen,https://maps.google.com/maps?cid=14189837939564552736,Other people like more than but food always wrong Maybe the problem,--,--,people food wrong problem,0.744,0.256,0.0,-0.7003,Negative
07/28/21,Google,83056 JASPER,4223 Mannheim Road   -,Jasper,IN,47546,4,Tony Kendall,https://maps.google.com/maps?cid=11612739214779918035,love eating here but people need get back work cook Applebee Very limited menu,--,--,people work cook applebee limited menu,0.275,0.725,0.0,-0.2263,Negative
07/28/21,Google,76075 LAKE BUENA VISTA,13351 SR 535   -,Orlando,FL,32821,3,Ken Williams,https://maps.google.com/maps?cid=11012073272748190257,not bad Its chain and this location even though connected hotel never crowded dine there least once month,--,--,bad chain location hotel least month,0.412,0.588,0.0,-0.5423,Negative
07/28/21,Google,97009 KEARNEY,5605 2nd Ave.   -,Kearney,NE,68848,1,Charlotte Sprague,https://maps.google.com/maps?cid=6616620271502460314,Had chicken wrap hardly any chicken mostly lettuce and melted cheese Service was poor,--,--,cheese service poor,0.608,0.392,0.0,-0.4767,Negative
07/28/21,Google,75052 SOMERS POINT,51 Bethel Road   -,Somers Point,NJ,08244,1,sammyL Jackson,https://maps.google.com/maps?cid=8830698302657262354,decided get Applebee for late dinner Tuesday night Checked hours open midnight perfect arrive Plenty parking not busy inside family walked right ahead The greeter told them min wait That odd place definitely not busy bar empty maybe tables occupied They decided wait tell them just for tonight same min wait did not stay sign something has gone wrong and sure more then min wait half the tables are empty one bar that tells that poor Management have the bar tender cover table two offer sit bar The greeter could have covered table But can hear now not job Where the manager Should out and about covering issues was business surely would not want see fail,--,--,applebee late dinner night hour midnight perfect arrive plenty parking busy family odd place busy bar empty table wait tonight sign wrong half table empty bar poor management bar tender cover table bar greeter table job manager issue business,0.248,0.676,0.076,-0.7506,Negative
07/28/21,Google,82037 SHAKOPEE,1568 Vierling Drive   -,Shakopee,MN,55379,3,Zane Schwab,https://maps.google.com/maps?cid=3792392831047918056,Food was alrite for the price the staff was pretty rude though They messed our order and when let them know they acted like was our fault,--,--,food price staff rude messed order fault,0.669,0.331,0.0,-0.7964,Negative
07/28/21,Google,97068 BRIER CREEK,8701 Brier Creek Parkway   -,Raleigh,NC,27617,1,L,https://maps.google.com/maps?cid=7933694151966071464,ordered through uber eats and was over for people the meals arrived without the sides Also medium sirloin arrived beyond well done and almost impossible cut was given for inconvenience uber eats REALLY meals with sides are not meals Lesson learned order food through uber eats the restaurant can give not give whatever order and out food and money Applebee PLEASE double check your orders before sending them out,--,--,people meal side medium sirloin impossible cut inconvenience eat side meal order restaurant order food money double check order,0.213,0.787,0.0,-0.5574,Negative
07/28/21,Google,83053 W. EVANSVILLE,5727 Pearl Drive   -,Evansville,IN,47712,5,Ryan Becker,https://maps.google.com/maps?cid=6831112043060364023,Consistently average not have crazy expectations and you not disappointed,--,--,average crazy expectation,0.545,0.455,0.0,-0.34,Negative
07/28/21,Google,75079 WESTBURY,1300 Corporate Drive   -,Westbury,NY,11590,1,cassie Rivera,https://maps.google.com/maps?cid=14702120500730217911,One the worse Apple bees been Poor service Dirty silverware Food was nasty dry Had eat with hands first Cause took the waitress more than minutes get our Forks Smh,--,--,bad apple bee poor service dirty silverware food dry hand cause waitress minute fork,0.419,0.441,0.141,-0.743,Negative
07/28/21,Google,98092 TARA BLVD,6727 Tara Blvd   -,Jonesboro,GA,30236,2,deborah carpenter,https://maps.google.com/maps?cid=15186834273840259504,Service was nice but this place never clean floor and tables always nasty,--,--,service nice place floor table nasty,0.346,0.385,0.269,-0.2023,Negative
07/28/21,Google,80020 KATY,19625 Restaurant Row   -,Houston,TX,77084,2,Sonji Magee,https://maps.google.com/maps?cid=7130923063078558731,Needs updating and cleaning the carpet nasty Food service good,--,--,carpet nasty food,0.643,0.357,0.0,-0.5574,Negative
07/28/21,Google,95079 CRESTVIEW,215 Rasberry Road   -,Crestview,FL,32536,4,Renita Bowman,https://maps.google.com/maps?cid=5845249583886908659,place dang cold inside But service was good Only thing the cheese withe pretzels sticks looked like nasty gravy instead the sauce they were out,--,--,place cold inside service thing cheese pretzel stick nasty gravy,0.286,0.714,0.0,-0.5574,Negative
07/28/21,Google,76007 UNIONTOWN,102 Walmart Drive   -,Uniontown,PA,15401,1,Matt Himes,https://maps.google.com/maps?cid=12321037513709524657,Absolutely horrible The whole family was hours after eating here,--,--,horrible whole family hour,0.538,0.462,0.0,-0.5423,Negative
07/28/21,Google,89099 ANDERSON,1922 E 53rd Street   -,Anderson,IN,46013,1,Dennis Donaldson,https://maps.google.com/maps?cid=889405712820435987,Stood the door for about minutes waiting alot empty seats plenty waiters still service left and went Texas steakhouse was crowded but they told how long will just walked the door not back Applebees,--,--,door minute alot empty seat plenty waiter service door applebee,0.167,0.833,0.0,-0.2023,Negative
07/28/21,Google,99002 VALRICO,1905 S.R. 60 East   -,Valrico,FL,33594,2,Road Warrior,https://maps.google.com/maps?cid=16968972693641361217,Nasty bathrooms and overall not clean had one drink had water and left,--,--,nasty bathroom clean drink water,0.387,0.323,0.29,-0.2263,Negative
07/28/21,Google,88035 SALINA,2875 South 9th   -,Salina,KS,67401,1,george yeager,https://maps.google.com/maps?cid=17641881263250589546,You want menu Better have your phone Dirty silverware Just not enjoyable visit Doubt back,--,--,phone dirty silverware enjoyable visit doubt,0.478,0.265,0.257,-0.3612,Negative
07/28/21,Google,90091 DUSSEL,531 Dussel Road   -,Maumee,OH,43537,1,Brian Ogden,https://maps.google.com/maps?cid=10038005230636495808,Let just say the cooks not clean any work surface and everything brushed the floor which then they spray water which considered dirty which everything dirty actually sick and this store the Applebee training store and health inspector would nuts,--,--,cook work surface floor spray water dirty dirty sick store applebee training store health inspector nut,0.412,0.588,0.0,-0.8442,Negative
07/28/21,Google,77036 CHAMPIONS WAY,2050 E. Highway 50   -,Clermont,FL,34711,2,HOLY LAND MAN,https://maps.google.com/maps?cid=724164516980972551,Set the bar and was dirty with glasses from hour ago left,--,--,bar dirty glass hour,0.492,0.508,0.0,-0.4404,Negative
07/28/21,Google,94060 DUBUQUE,1395 Associates Drive   -,Dubuque,IA,52002,1,Justin,https://maps.google.com/maps?cid=15554464471813904312,The have poor management and their employees have bad attitudes They discriminate against customers Also they should close They need train their employee better poor service Their management dress sloppy and their food always cold The employees are very incompetent They have awful food They should close The employees have bad manners and bad working skills They not know what their doing You discriminate Their management has very poor job communicamition skills There management should lose their jobs Their food terrible Amber should lose her job will send health department them Their food are always wrong temp They keep cold foods hot and serve food that suppose hot cold They discriminate and they discriminate against people disabilities and different races They discriminate and should close There managers should fired They have bad food will reck them for ever civil court They wil sued and file civil rights complaint with iowa civil rights commission have already contact ICRC twice and health department they put bugs food They should shut down for unclean condtions They spit food,--,--,poor management employee bad attitude customer need train employee well poor service management dress sloppy food cold employee awful food close employee bad manner bad working skill discriminate management poor job communicamition management job food terrible amber job health food wrong temp cold food hot food hot cold discriminate discriminate people different race close manager bad food reck civil court file civil right complaint icrc health department bug food unclean condtion spit food,0.355,0.624,0.021,-0.9856,Negative
07/28/21,Google,91022 ELGIN,125 South Randall Road   -,Elgin,IL,60123,1,Anna Corpin,https://maps.google.com/maps?cid=17412384617435383738,Horrible Service and food were salty,--,--,horrible service food salty,0.538,0.462,0.0,-0.5423,Negative
07/28/21,Google,89049 PUYALLUP,3510 South Meridian   -,Puyallup,WA,98373,1,Kendra Jackson,https://maps.google.com/maps?cid=10574398157361401837,The food was disgusting got sirloin steak with loaded mashed potatoes Everything was FLAVORLESS boyfriend and looked each other and started laughing because was gross AND top off the did not give the DoorDash employee any plastic silverware Absolutely not worth dime what paid would been happier with fast food with something could actually savor,--,--,food disgusting steak potato flavorless boyfriend gross top doordash employee plastic silverware worth dime fast food,0.293,0.541,0.167,-0.5859,Negative
07/28/21,Google,93048 NEW PORT RICHEY,8537 Little Road   -,New Port Richey,FL,34654,5,Angela Sowers (Angie),https://maps.google.com/maps?cid=10859420400404709913,was anniversary and usual Applebee did not disappoint,--,--,anniversary usual applebee disappoint,0.474,0.526,0.0,-0.4019,Negative
07/27/21,Google,97034 CUTLER RIDGE MALL,20505 S. Dixie Hwy.   -,Miami,FL,33189,1,Christophe Fiol,https://maps.google.com/maps?cid=5923223370296297333,Awful place spend your time and money Went there while the place was half empty queso dip had nasty hair had already drank whole lemonade before realized second one had black stuff all the bottom the cup probably have dishwasher gunk body Yay ordered the pretzel and cheese dip and just never came out Sat there for about hour and the waitress never came the table Then asked for the check which took another half hour just got and left Thanks for the free garbage you call food and service,--,--,awful place time money half empty queso dip nasty hair whole lemonade second black stuff bottom cup table check half hour thank free garbage call food service,0.232,0.608,0.16,-0.3818,Negative
07/27/21,Google,85015 FOUNTAIN,6428 S. Hwy. 85/87   -,Fountain,CO,80817,1,Makayla B,https://maps.google.com/maps?cid=17500861837925546523,Very poor experience have tried give this location multiple times coming and every time getting worse salmon was way over cooked was rubber waitress couldn even get order right boyfriend ordered steak well done came out pink and bloody Roommate food came out missing items waited over hour and min here They really need evaluate management and get better service here very upset and disappointed this establishment wait come until better management and staff are duty here,--,--,poor experience location multiple time time bad salmon way rubber waitress order right boyfriend pink bloody roommate food missing item hour min evaluate management well service upset disappointed establishment wait well management staff duty,0.366,0.546,0.088,-0.9217,Negative
07/27/21,Google,93046 MAYS LANDING,700 Consumers Sq   -,Mays Landing,NJ,08330,5,Kenneth Martin,https://maps.google.com/maps?cid=18420118768137899614,Always pleasure not say one bad thing great place where you not have worry about anyting tasting inappropriate,--,--,bad thing great place worry tasting inappropriate,0.441,0.276,0.283,-0.3182,Negative
07/27/21,Google,96043 DEL RIO,"2205 Veterans Blvd, Suite F16   -",Del Rio,TX,78840,1,Carlos E,https://maps.google.com/maps?cid=2705412830860457919,Worst Applebee visited beers menu not stock beer served not cold enough double glazed ribs dry overcooked heated was bad,--,--,bad beer cold double rib overcooked heated,0.368,0.632,0.0,-0.5423,Negative
07/27/21,Google,81053 MILFORD,91 Medway Rd #1   -,Milford,MA,01757,1,Henry Sabourin4,https://maps.google.com/maps?cid=11717733520913781028,Staff was friendly and very efficient Food wasn bad but found bug our food This the time this has happened Once accident Twice lack cleaning being observant what you are serving customer Sadly will not going back,--,--,staff friendly efficient food bad bug food time accident lack cleaning observant customer,0.389,0.349,0.262,-0.4404,Negative
07/27/21,Google,94016 BOARDMAN,6691 South Avenue   -,Boardman,OH,44512,4,Melissa Haloulos,https://maps.google.com/maps?cid=2354885717963891039,Food came out fairly quickly attentive service Ladies bathroom was disgusting,--,--,food attentive service lady disgusting,0.459,0.541,0.0,-0.5267,Negative
07/27/21,Google,94002 CARROLLWOOD,15090 N. Dale Mabry Highway   -,Carrollwood,FL,33618,1,Jeff S,https://maps.google.com/maps?cid=4317744936256024202,Terrible service Will definitely never back,--,--,terrible service,0.756,0.244,0.0,-0.4767,Negative
07/27/21,Google,84047 NORTH ACADEMY,7625 Goddard Street   -,Colorado Springs,CO,80920,1,Dawn McMullan,https://maps.google.com/maps?cid=16446380047659997031,Both chicken bowls were horrible Very odd taste Fish and chips were burnt overcooked and greasy,--,--,chicken horrible odd taste fish chip overcooked greasy,0.492,0.508,0.0,-0.7003,Negative
07/27/21,Google,91098 ST. CLAIRSVILLE OH,50655 Valley Frontage Road   -,St. Clairsville,OH,43950,1,chris hindman,https://maps.google.com/maps?cid=14893051028238415477,This was the worse time have had there long time wings where nasty all get mostly fat the wings gross will say and lady waiters waited could move faster then her just saying,--,--,bad time long time wing fat wing gross lady waiter,0.452,0.548,0.0,-0.765,Negative
07/27/21,Google,99013 CONYERS,1448 Dogwood Dr.   -,Conyers,GA,30013,1,Michael Biggs Yo,https://maps.google.com/maps?cid=4982356527288799261,The closed their dinning room hour before closing time was not fault that was not allowed dine but the manager refused budget giving the half off appetizers,--,--,closed dinning room hour closing time fault manager budget half appetizer,0.213,0.787,0.0,-0.4019,Negative
07/27/21,Google,84098 SPRINGFIELD,3026 Gateway Street   -,Springfield,OR,97477,3,Jordan Jones,https://maps.google.com/maps?cid=1630610654451654652,Dinner was kind slow They were under staffed and was told was minute for table around the corner the entrance The lady the door making random excuses for reasons for the delay and all sorts stuff While were sat our waitress was prompt and worked hard get out order right Dinner overall was alright but think skip for another place next time,--,--,dinner minute table random excuse reason delay sort stuff order dinner place next time,0.147,0.769,0.083,-0.25,Negative
07/27/21,Google,98083 RADCLIFF,2059 Walmart Way   -,Radcliff,KY,40160,1,Julian Ramirez-Torres,https://maps.google.com/maps?cid=1949104736587625629,hours get our food and minutes after getting our check finally leave The worst Applebee ever been Last week came and the same experience The staff seem not here physically mentally,--,--,hour food minute check bad applebee last week experience staff,0.28,0.72,0.0,-0.5423,Negative
07/27/21,Google,84007 WALKER,4475 Lake Michigan Drive NW   -,Walker,MI,49534,5,Ian Kennelly,https://maps.google.com/maps?cid=1893790985873027340,Travis the waiter was absolute savage Give that boy raise,--,--,absolute savage boy raise,0.5,0.5,0.0,-0.4588,Negative
07/27/21,Google,98004 LAWRENCE,10655 Pendleton Pike   -,Indianapolis,IN,46236,1,Lynda Sam,https://maps.google.com/maps?cid=14548082241668638312,From the time walked was dead The hostess had took min figure out where were sitting Then after were seated the server took drink order came back instantly son drink had hair food semi was not right tried get the server attention she told hold resume conversation with her colleagues Very unprofessional Wish could give stars,--,--,time dead hostess min figure server drink order son hair food server attention hold resume conversation colleague unprofessional wish star,0.278,0.623,0.099,-0.7096,Negative
07/27/21,Google,80045 MESQUITE,19035 I-635   -,Mesquite,TX,75150,2,Jofiel Morales,https://maps.google.com/maps?cid=8860305340297592975,The service was terrible The place was practically empty yet waited for hour before they took our order and they left before all ordered been here for hours and just now got our food There are other tables people besides The servers are nowhere seen,--,--,service terrible place empty hour order hour food table people server,0.353,0.647,0.0,-0.5994,Negative
07/27/21,Google,75026 MT. OLIVE,50 International Dr S   -,Flanders,NJ,07836,1,Gabrielle Carpenter,https://maps.google.com/maps?cid=11175335365301221351,Didnt get order right and then asked want come back and pick thank you poor job mess make right know they will hire again,--,--,order want pick poor job mess right,0.514,0.367,0.119,-0.6486,Negative
07/27/21,Google,78033 8 MILE,2111 West Eight Mile Rd   -,Detroit,MI,48203,1,LaShanda Craft,https://maps.google.com/maps?cid=11746959218495040180,Terrible service waited Carside for hour minutes for salads,--,--,terrible service hour minute salad,0.437,0.563,0.0,-0.4767,Negative
07/27/21,Google,88049 SPRING RD,2728 Spring Rd. SE   -,Atlanta,GA,30339,1,Jennifer Cuyler,https://maps.google.com/maps?cid=6145579100819980074,took minutes even get our order Nobody else was there patient because know the COUNTRY SHORT WORKERS but when you dont even greet your table for minutes and their food comes before you even bring their drinks and again maybe maybe tables the whole entire place including the bar this was very confusing aggravating experience Wont back this location Packed food containers and left And server still dont know what servers name was major turn off,--,--,minute order patient country short worker table minute food drink table whole entire place bar aggravating experience location food container server server major turn,0.087,0.913,0.0,-0.296,Negative
07/27/21,Google,76086 MAINGATE,14990 E Orange Lake Blvd   -,Kissimmee,FL,34747,1,Ruth Rosinski,https://maps.google.com/maps?cid=9261423004846484889,When and son walked and was not really busy all stood there sitted the hostess that could ahead and start dinner well look over left and there nothing but filthy tables where they have not been cleaned all were standing there waiting for good minutes before finally asked waitress were supposed seat ourself many waiters and waitresses walked looked and did not say anything Table still not bewn cleaned the time were waiting after finally get seated requested manager right away the waiter then comes over and says you want something drink instead asking hey what can get you drink course want drink come the restaurant eat why would not want drink She took our order ordee cam out wrong said fries but got mashed potatoes They were lule warm this point just didnt want tjere anymore picked food son pizza was luke warm didnt eat his said tasted bad Never git refill our drinks Made feel like incovience this point will never return this establishment all local will drive further different one NOT RECCOMMEND THIS ESTABLISHMENT,--,--,busy sitted hostess dinner filthy table waiting minute seat many waiter waitress table time requested manager waiter drink course drink restaurant eat drink order fry potato lule warm point bad refill drink incovience point establishment local drive different reccommend establishment,0.081,0.876,0.044,-0.3818,Negative
07/27/21,Google,80073 COMMERCE,455 Haggerty Hwy.   -,Commerce Township,MI,48390,4,Chen Subramanian,https://maps.google.com/maps?cid=16744343174116201382,Delayed service due lack employees,--,--,service due lack employee,0.434,0.566,0.0,-0.3182,Negative
07/27/21,Google,89018 NIAGARA FALLS,1608 Military Road   -,Niagara Falls,NY,14304,1,Antone'a Davis,https://maps.google.com/maps?cid=6205841525268859688,Applebees sucks when comes Doordash orders are wrong many times Whoever they have working there needs retrained,--,--,doordash order wrong many time need,0.383,0.617,0.0,-0.4767,Negative
07/27/21,Google,94096 CITY LINE,7650 City Line   -,Philadelphia,PA,19151,1,Natasha Perkins,https://maps.google.com/maps?cid=1234702255841847924,This place absolutely horrible Ordered the cajan blackened salmon via UberEats and they sent salmon with sides Will not ordering from here anymore When called and asked speak manager the employees were rude,--,--,place horrible cajan ubereat salmon side speak manager employee rude,0.448,0.552,0.0,-0.7579,Negative
07/27/21,Google,89099 ANDERSON,1922 E 53rd Street   -,Anderson,IN,46013,1,Griselda Gamiz,https://maps.google.com/maps?cid=889405712820435987,Food was bad Service was slow,--,--,food bad service slow,0.538,0.462,0.0,-0.5423,Negative
07/27/21,Google,76075 LAKE BUENA VISTA,13351 SR 535   -,Orlando,FL,32821,1,michelle dodd,https://maps.google.com/maps?cid=11012073272748190257,Where management This the WORST ran chain restaurant been long time stayed the attached hotel and had the unfortunate experience eating here more then one occasion and some how each time the service got worse and worse The SLOWEST service imaginable The restaurant wasn even that busy and the service was turtles pace Each server encountered seemed less capable then the one before sat for mins before our server even came over say hello and take our drink order all wanted was water for crying out loud attempted call order one night and the person taking order said cheese burger wasn the kids meal menu but she would ring grilled cheese and let the cooks know SMH had ordered burgers off the kids meal the day before The last attempt this dump had walk off when were suddenly given the bar tender our server and asked would like leave WTAF Seriously does this place have manager staff husband said maybe they are under staffed but that can the case saw several servers just standing around work the restaurant industry and seen lot this place seriously needs intervention,--,--,management chain restaurant long time hotel unfortunate experience occasion time service bad slow service imaginable restaurant busy service pace capable min server drink order water call order night person order cheese menu cheese cook meal day last attempt dump walk bar tender server place manager staff husband case several server work restaurant industry lot place intervention,0.143,0.816,0.041,-0.7579,Negative
07/27/21,Google,91065 DELAWARE,2656 Delaware Avenue   -,Buffalo,NY,14216,1,Josephine Cortes,https://maps.google.com/maps?cid=13831914156750491646,Got sick off the food,--,--,sick food,0.767,0.233,0.0,-0.5106,Negative
07/27/21,Google,94002 CARROLLWOOD,15090 N. Dale Mabry Highway   -,Carrollwood,FL,33618,4,Michael Mcmullen,https://maps.google.com/maps?cid=4317744936256024202,mean was applebees wonton tacos and cheese burger pretty hard mess,--,--,hard mess,1.0,0.0,0.0,-0.4404,Negative
07/27/21,Google,83093 S-COLDWATER,787 E. Chicago   -,Coldwater,MI,49036,1,Andrew Ferris,https://maps.google.com/maps?cid=6701922760757801816,you were like you forgot just how terrible Applebee was during Covid Server who was nice when saw her but she was nonexistent and misheard and gave the wrong food then told that the food that wanted wasn available Then when eating food that did want realized the sad fact that can make this food home and would taste much better,--,--,terrible covid server nonexistent misheard wrong food food available food want sad fact food well,0.41,0.441,0.15,-0.7845,Negative
07/27/21,Google,95006 OAK CREEK,7135 S. 13th Street   -,Oak Creek,WI,53154,2,Olivia White,https://maps.google.com/maps?cid=17951203019139890840,The wings weren fully covered the sauce pretty sure they didn even give wings more like asked for medium rare burger and received burger that was fully cooked mentioned the waitress the problems and she just said sorry don wanna upset with the waitress but just disappointed,--,--,wing sauce wing medium rare burger waitress problem,0.278,0.722,0.0,-0.4019,Negative
