07/27/21,Google,94023 QUEENSBURY,255 Quaker Road   -,Queensbury,NY,12804,1,Rye â€œMammaâ€ Baker,https://maps.google.com/maps?cid=7086876392517359410,Customer service horrible Management Mark Matt absolutely the most disrespectful human ever encountered,--,--,customer horrible management mark disrespectful human,0.412,0.588,0.0,-0.5423,Negative
07/27/21,Google,77000 GARLAND,1440 Eastgate Drive   -,Garland,TX,75041,3,Adrian Meza,https://maps.google.com/maps?cid=3893305407956961473,Food was good but took forever and service was poor,--,--,food service poor,0.608,0.392,0.0,-0.4767,Negative
07/26/21,Google,76004 LONG ISLAND CITY,38-01 35th Avenue   -,Astoria,NY,11101,1,Wyuesing,https://maps.google.com/maps?cid=7320631759372074204,This Applebee trash The server was completely unattentive Took our order and then never saw him again did not check the food came out okay even refill our drinks When gave the check just threw down not even thank you have good night The food was poor also taste flavor just overall bad Also the music outside for outdoor seating obnoxiously loud This family restaurant and should treated such not club bar Will never return here again,--,--,trash server unattentive order check food refill drink check night food poor flavor bad music outdoor family restaurant club bar,0.268,0.732,0.0,-0.765,Negative
07/26/21,Google,80052 CARROLLTON,3565 Frankford Road   -,Dallas,TX,75287,1,Dean Peterson,https://maps.google.com/maps?cid=2269015143968131726,you value your money definitely recommend going Whataburger next door food horrendous and service even worse try give this place several tries seem get better,--,--,value money next door food horrendous service bad place several try well,0.369,0.404,0.227,-0.5859,Negative
07/26/21,Google,97054 WEST ALLIS,2865 S. 108th Street   -,West Allis,WI,53214,3,Mae Epperson,https://maps.google.com/maps?cid=4932328278907849018,Some one came restaurant drunk and caused confusion and fight police was called remove drunk customer all this went right our tahle still paid for meal that was ruined this man got discounts paid for full meal and left nice tip had very good waitress not her fault was the drunk fault went jail and left hungry lol,--,--,restaurant drunk confusion fight police drunk customer tahle meal man discount full meal nice tip drunk fault jail hungry lol,0.455,0.372,0.173,-0.7964,Negative
07/26/21,Google,80031 DENTON,707 S Interstate 35 E   -,Denton,TX,76205,1,Beth Bayless-Snider,https://maps.google.com/maps?cid=18335528689653460918,terrible curbside pickup service ignored employees wait minutes had ask anybody was ever going help Boyz help voice dissatisfaction and then got yelled manager because griped his employee for the fact that she ignored twice and then others ignored also and they ignored another customer until said something,--,--,terrible pickup service employee minute help boyz voice dissatisfaction manager employee fact other customer,0.315,0.55,0.135,-0.5574,Negative
07/26/21,Google,99098 JERSEY CITY,"Hudson Mall, 701 Rt. 440 South   -",Jersey City,NJ,07304,1,Nateya R.,https://maps.google.com/maps?cid=4892682854345099526,Terrible service Went here for quick late night bite and took almost hour for our order taken Then the food came out cold hard and obviously not fresh,--,--,terrible service quick late night bite hour order food cold fresh,0.215,0.625,0.16,-0.2023,Negative
07/26/21,Google,78015 ALHAMBRA,21 E. Main Street   -,Alhambra,CA,91801,2,Mark Colt,https://maps.google.com/maps?cid=12371145359329622410,amount drinks could make for its lame vibe,--,--,amount drink lame vibe,0.483,0.517,0.0,-0.4215,Negative
07/26/21,Google,85011 WINDSOR SPRING,2125 Windsor Spring Road   -,Augusta,GA,30906,1,Twin's Nation,https://maps.google.com/maps?cid=7500713321579496100,Bad service tonight Food was cold Don come late this location You left with empty cups and cold food along with server insight All got was thousand sorry stories,--,--,bad service tonight food cold late location empty cup cold food sorry story,0.398,0.602,0.0,-0.6808,Negative
07/26/21,Google,94038 BEACH,10071 Hutchison Blvd   -,Panama City Beach,FL,32407,1,Leslie Williams,https://maps.google.com/maps?cid=8319680711115040052,Horrible waited minutes seated dirty table and then for drink and never came take food order they were not even busy,--,--,horrible waited minute dirty table drink food order busy,0.478,0.522,0.0,-0.7506,Negative
07/26/21,Google,83063 WEST LEBANON,280 Plainfield Road   -,West Lebanon,NH,03784,2,John Bartenstein,https://maps.google.com/maps?cid=2131036496395925078,What can say The food microwaved from bags The service slow and the drinks are horrible The only reason were there was because after night work nothing else was open always disappointed Applebee matter what city state,--,--,food bag service slow drink horrible reason night work open state,0.259,0.741,0.0,-0.5423,Negative
07/26/21,Google,94074 FOLEY,2409 S. McKenzie Street   -,Foley,AL,36535,2,Felipe Moreira,https://maps.google.com/maps?cid=9247665339384688639,Good menu and prices are considerably good although service here horrible Expect long wait times for waiting for table your order Applebee being bad represented here,--,--,price service horrible long wait time table order applebee,0.304,0.696,0.0,-0.5423,Negative
07/26/21,Google,99098 JERSEY CITY,"Hudson Mall, 701 Rt. 440 South   -",Jersey City,NJ,07304,2,Jess_bae_ 13,https://maps.google.com/maps?cid=4892682854345099526,Poor service Came enjoy meal with family and took plus minutes just can get our order,--,--,poor service meal family minute order,0.383,0.617,0.0,-0.4767,Negative
07/26/21,Google,97054 WEST ALLIS,2865 S. 108th Street   -,West Allis,WI,53214,1,Kim Fink,https://maps.google.com/maps?cid=4932328278907849018,Extremely Disappointed Rib tips were crispy with dry inside sister ordered nachos few pieces crumbles chicken and beef They just let employee when walked Pandemic pandemic Very disappointed Will not patronize this restaurant again,--,--,disappointed rib tip dry sister piece beef employee pandemic pandemic patronize restaurant,0.22,0.78,0.0,-0.4767,Negative
07/26/21,Google,99032 LIMA EAST,1925 Roschman Ave.   -,Lima,OH,45804,1,Karl Guetschow,https://maps.google.com/maps?cid=8258060247054699855,Ordered through doordash and they did not even send half order then when complaint was filed they refused refund for what they didnt send with the dasher they essentially stole from,--,--,half order complaint refused refund,0.595,0.405,0.0,-0.5267,Negative
07/26/21,Google,96028 GRAND & BELL,13756 W. Bell Road   -,Surprise,AZ,85374,1,Cheryl Scharboneau,https://maps.google.com/maps?cid=7779507225803622174,Horrible experience Food seat when got there Waitress was also the bartender and was having very inappropriate disgusting conversation with man that could have been her grandfather the bar music Weird eery silence except the manager yelling his employees walked our table times and made eye contact but interactions Food was horrible and the food runner cut our burger half for because were splitting meal Very odd French fries were hours old Had bar for salt and napkins and ask for bill Never again,--,--,horrible experience food seat inappropriate disgusting conversation man bar music weird eery silence manager employee table time eye contact interaction food horrible cut half splitting meal odd french fry old bar salt napkin bill,0.405,0.595,0.0,-0.9468,Negative
07/26/21,Google,82037 SHAKOPEE,1568 Vierling Drive   -,Shakopee,MN,55379,5,David Melton,https://maps.google.com/maps?cid=3792392831047918056,Picked our food and did not check our food They gave the wrong wings and the steak was undercooked red Normally everything good but not this time,--,--,food check food wrong wing undercooked red time,0.307,0.693,0.0,-0.4767,Negative
07/26/21,Google,75087 AVON GABLES,9883 East U.S. 36   -,Avon,IN,46123,1,Dave Percifield,https://maps.google.com/maps?cid=8168191297278313951,Doors unlocked called min prior people still facility Manager Jeremy refused his last name also refused tell owners name followed out the doors threw his keys down and was wanting fight since told him bad business not change the sign the door nothing posted other than hours were open until midnight Absolutely the worst service any restaurant have ever seen,--,--,door unlocked prior people facility manager last name owner name door key fight bad business change sign door hour open midnight bad service restaurant,0.314,0.686,0.0,-0.8625,Negative
07/26/21,Google,90089 GATEWAY,7956 Gateway East   -,El Paso,TX,79915,2,Michele Ray,https://maps.google.com/maps?cid=7027218540186888541,While the server was good the food was not not eaten this location couple years and will not going back Disappointing,--,--,food location couple year disappointing,0.444,0.556,0.0,-0.4939,Negative
07/26/21,Google,95026 CORPUS CHRISTI,6691 S. Padre Island Dr.   -,Corpus Christi,TX,78412,4,Lupe Ortiz,https://maps.google.com/maps?cid=18384891555989712689,Replaced salad that was wrong,--,--,salad wrong,0.756,0.244,0.0,-0.4767,Negative
07/26/21,Google,78050 CELEBRATION,6290 W. Irlo Bronson Memorial Hwy   -,Celebration,FL,34747,2,Gael Yu,https://maps.google.com/maps?cid=17479066973982600942,Bad Experience and Bad Service,--,--,bad experience bad service,0.778,0.222,0.0,-0.7906,Negative
07/26/21,Google,89012 REDDING,1801 Hilltop Drive   -,Redding,CA,96002,1,Sean F,https://maps.google.com/maps?cid=11293124175302792665,Ridiculous wait time for doordash,--,--,ridiculous time doordash,0.556,0.444,0.0,-0.3612,Negative
07/26/21,Google,80072 MADISON HEIGHTS,1275 West 14 Mile Road   -,Madison Heights,MI,48071,1,Jane Ogden,https://maps.google.com/maps?cid=9571238272507607555,Absolutely disgusting,--,--,disgusting,1.0,0.0,0.0,-0.5267,Negative
07/26/21,Google,88007 83RD & BELL,8001 West Bell Road   -,Peoria,AZ,85382,1,Patty Simmons,https://maps.google.com/maps?cid=91637160092344909,Dirty table completely over cooked steak and cold mashed potatoes Very disappointed,--,--,dirty table cooked steak cold potato,0.367,0.633,0.0,-0.4404,Negative
07/26/21,Google,82074 ANTHEM,10305 S. Eastern Ave.   -,Henderson,NV,89052,1,Raul Marquez,https://maps.google.com/maps?cid=11281902932747943724,Poor service the host was not helping not good,--,--,poor service host,0.608,0.392,0.0,-0.4767,Negative
07/26/21,Google,94025 COUNCIL BLUFFS,3000 Dial Drive   -,Council Bluffs,IA,51501,1,Tyler Younger,https://maps.google.com/maps?cid=16887326171026910764,This place seems like bad joke lots sloppy looking people shuffling around not helping anyone staff seems lazy and gross Waitress was flirting with some dude the bar across the other side the restaurant,--,--,place bad joke lot sloppy people staff lazy gross waitress dude bar side restaurant,0.427,0.469,0.103,-0.7845,Negative
07/26/21,Google,82027 INVER GROVE,5855 Blaine Avenue   -,Inver Grove Heights,MN,55076,3,David Brekke,https://maps.google.com/maps?cid=10530327641805847734,Typicall Applebee low prices for low quality over seasoned food,--,--,typicall low price low quality food,0.512,0.488,0.0,-0.4939,Negative
07/26/21,Google,83081 WEST LANSING,5400 West Saginaw   -,Lansing,MI,48917,1,D R,https://maps.google.com/maps?cid=16398533861021752604,Staff took forever with our order after telling what could order because they where out alot items even drinks then Forgot things and ended sitting waiting for food while everyone table ate Manager Chelsea did not see problem with anything Completely understand things are not available waiting but waiting for wrong order waiting while everyone table eats and you see nothing wrong try fix problem Step your staff especially management,--,--,staff order alot item thing food table manager problem thing available wrong order table eat wrong fix problem step staff management,0.406,0.594,0.0,-0.891,Negative
07/26/21,Google,78039 POOLER,160 Tanger Outlets Pkwy.   -,Pooler,GA,31322,2,Leashia Davis,https://maps.google.com/maps?cid=11047904390791122725,Service was bad food was not good all,--,--,service bad food,0.636,0.364,0.0,-0.5423,Negative
07/26/21,Google,79006 LEAVENWORTH,2912 S. Fourth Street   -,Leavenworth,KS,66048,1,Harley Witter,https://maps.google.com/maps?cid=8285374118150219024,Horrible service good food,--,--,horrible service food,0.636,0.364,0.0,-0.5423,Negative
07/26/21,Google,77041 WILLOUGHBY,35055 Maple Grove Rd   -,Willoughby,OH,44094,2,Amanda Marie,https://maps.google.com/maps?cid=5870918614343296683,Service was great but brought wrong drink first but she got new one and she missed husband order but told her was okay won come back though sorry,--,--,service wrong drink new husband order sorry,0.468,0.532,0.0,-0.5267,Negative
07/26/21,Google,95040 HAWTHORNE,18 Saw Mill River Road   -,Hawthorne,NY,10532,2,Ervin Johnson,https://maps.google.com/maps?cid=16852092470474521148,wings were way overpriced would not have felt bad the waiter gave table minutes his time were there hour and minutes service two thumbs down,--,--,wing bad waiter table minute time hour minute service thumb,0.28,0.72,0.0,-0.5423,Negative
07/26/21,Google,97062 HERKIMER,630 W. State Street   -,Herkimer,NY,13350,1,SawBlade k,https://maps.google.com/maps?cid=1286476681843955050,Food been going downhill but today was the worst got clubhouse grille curbside they forgot the ham and turkey and burnt the sandwich,--,--,food today bad,0.636,0.364,0.0,-0.5423,Negative
07/26/21,Google,84026 BOISE AIRPORT,2810 W. Elder Street   -,Boise,ID,83705,1,Kyle â€œBad assâ€ Prettyman,https://maps.google.com/maps?cid=1056678684538398281,This bartender the picture should fired First thing told sorry are from North Idaho The rest our meal was very rude Our spot the bar was filthy like had not wiped down all night asked him too and blew off Very bad experience,--,--,first thing sorry meal rude spot bar filthy night bad experience,0.494,0.506,0.0,-0.7783,Negative
07/26/21,Google,80026 ARLINGTON,4654 South Cooper Street   -,Arlington,TX,76017,2,matt tomlinson,https://maps.google.com/maps?cid=8198829938593810117,Problems started soon walked the door Other than the bartender there were employees visible and took about minutes for someone acknowledge our existence There were tables seated after that received their meals before even had our appetizer including There was something inedible fiance pasta and were both left sitting with empty cups for over minutes tried multiple times get the managers attention but was busy flirting with table young women insisted seating and serving himself,--,--,problem door bartender employee visible minute existence table meal appetizer inedible fiance pasta empty cup minute multiple time manager attention busy flirting table young woman,0.159,0.777,0.064,-0.4019,Negative
07/26/21,Google,89013 HARBISON,5185 Fernandina Road   -,Columbia,SC,29212,1,His Nobody,https://maps.google.com/maps?cid=16205363677740059536,Bad place eat only one person was working,--,--,bad place person,0.636,0.364,0.0,-0.5423,Negative
07/26/21,Google,86098 N. ROAN ST,2100 North Roan Street   -,Johnson City,TN,37601,1,OneBraveMomOf3 - saved everything,https://maps.google.com/maps?cid=2729708598323664044,know why there was cars the parking lot Well some our groups meal was the others not good then the waitress was big airhead she rushed and was the stupid normally not say anything about people but not help this never seen someone stupid Will not back,--,--,car parking lot group other big airhead stupid people stupid,0.459,0.541,0.0,-0.7783,Negative
07/26/21,Google,89057 STOCKBRIDGE,3676 GA-138   -,Stockbridge,GA,30281,1,Tesha Chance,https://maps.google.com/maps?cid=9836102583033762220,there was option for stars they would get that Worse customer service ever The bartender threw the menus myself and guest got upset when asked about the drinks and when asked for manager the bartender started laughing When the manager Samuel did come was already laughing and talking the bartender concerns didn matter him Wow Not place visit even though right house rather ride another one,--,--,option star bad customer service menus guest upset drink manager bartender concern matter place right house one,0.288,0.66,0.052,-0.7184,Negative
07/26/21,Google,75045 STANDER,145 Stander Avenue   -,Mansfield,OH,44903,1,Ashley Smith,https://maps.google.com/maps?cid=2067651813592036429,Tonight was the worst experience have ever had this location ordered the food online and when arrived let them know was there After waiting about minutes someone came out and told the food would right out After about another mins the food finally came out cold wings and chicken strips were cold the wait was not bad enough now had take home and reheat the food that waited about mins for son and eat applebees lot and normally use this location because the way home but think from now may just choose somewhere else eat mean understand being busy but feel that because the food was cold had been sitting there while were waiting and know were not the only ones who waited women even left about mins after arrived because she had been sitting there long This location has poor reputation for timelines Update since this have ordered food from this one once again and came out lot faster and lot hotter happy with the way the staff has gotten faster with their service Even busy nights,--,--,tonight bad experience location food waiting minute food min food cold wing chicken strip cold wait bad home reheat food son applebee lot location way home think mean busy food cold sitting one woman min long location poor reputation timeline update food lot lot hotter happy way staff fast service busy night,0.163,0.777,0.06,-0.7506,Negative
07/26/21,Google,88097 ST. JOSEPH,4004 Frederick Blvd.   -,St Joseph,MO,64506,2,Hayley Sharp,https://maps.google.com/maps?cid=5383408047796044730,family and went eat late lunch and the restaurant was pretty empty took least minutes get our food and the waiter was not very attentive either Also the wait staff would not make tiktok with doing the fancy like dance there that,--,--,family late lunch restaurant empty least minute food waiter attentive staff tiktok fancy dance,0.122,0.878,0.0,-0.2023,Negative
07/26/21,Google,84001 GULL ROAD,5990 Gull Road   -,Kalamazoo,MI,49048,4,Willy,https://maps.google.com/maps?cid=11918705721315163837,Bar tender needs stay the bar wait customers because when they leave help waitresses that are motivated others there job They neglect there bar customers very patient man but lately patients has been tested when asked for another drink and told ill get right with you just see over drinks get put after drink order and filled before mine making wait long time for refill This ridiculous and unprofessional Also not see anyone washing there hands between taking order the bar and cleaning someone else DIRTY DISES there table HELLO COVID STILL EFFECT and what the government not telling anyone that people have DIED from getting the shot Florida the worst Wake people The shot was only effective start with WASH YOUR HANDS SHUT DOWN YOU ARE NOT STERLE Thanks for putting all your customers harms way Also dealing with money and not washing your hands Way Caroline and Frank both are violation this,--,--,bar tender bar customer help waitress other neglect bar customer patient man patient drink ill right drink drink order long time refill ridiculous unprofessional hand order bar dirty dis table government people bad wake people effective start hand sterle thank customer way money washing hand violation,0.294,0.458,0.248,-0.5106,Negative
07/26/21,Google,80032 W. FREEWAY,6600 West Freeway   -,Fort Worth,TX,76116,1,Albert Stevens,https://maps.google.com/maps?cid=1696161199198543151,dead fly was our table prior sitting down,--,--,dead table,0.811,0.189,0.0,-0.6486,Negative
07/26/21,Google,81073 HAVERHILL,56 Plaistow Road   -,Haverhill,MA,01830,1,Justine Comeau,https://maps.google.com/maps?cid=17550984915177761468,Went the location Haverhill Server Krystal was doll but the steaks and husband got were not pictured the website They were fatty and disgusting brought them back The manager Tom White just charged for the app and drinks feel robbed didnt even get drink drink because did not get eat dinner tip for drinks and mozz sticks would not back,--,--,location haverhill husband website fatty disgusting manager drink drink drink eat dinner tip drink mozz stick,0.185,0.815,0.0,-0.5267,Negative
07/26/21,Google,96006 ROBINSON,6570 Rt.60 Steubenville Pike   -,Pittsburgh,PA,15205,1,CoCoPo12 Powers,https://maps.google.com/maps?cid=17564406388224401670,Not family have been other Applebee that are way better Food always burnt and service sucks,--,--,family way well food service suck,0.322,0.444,0.233,-0.2023,Negative
07/26/21,Google,95099 ARLINGTON RD.,2897 S. Arlington Road   -,Akron,OH,44312,5,D W,https://maps.google.com/maps?cid=3023585059374435018,called change order made mistake and ordered classic cheeseburger instead hamburger The door dash driver was still waiting the order but the girl charge pick orders refused change because she said she could not would not have the driver wait was already waiting How long does take cook burger minutes Very poor customer service,--,--,change order mistake classic cheeseburger door dash driver order girl charge pick order change cook burger poor customer service,0.244,0.756,0.0,-0.6705,Negative
07/26/21,Google,86032 GREAT NORTHERN,5010 Great Northern Plaza South   -,North Olmsted,OH,44070,1,Susan Reichle,https://maps.google.com/maps?cid=213695484802858732,ordered rib eye steak well done and was somewhat pink inside and top that off had alot fat and gristle and did not taste that great never order that again frustrated with this restaurant not seem get order right,--,--,pink top alot fat taste frustrated restaurant order right,0.279,0.574,0.148,-0.3818,Negative
07/26/21,Google,96037 MANAHAWKIN,205 Rt. 72 West   -,Manahawkin,NJ,08050,1,Emme,https://maps.google.com/maps?cid=10275813209344710199,Hair lavacake Absolutely disgusting,--,--,hair disgusting,0.773,0.227,0.0,-0.5267,Negative
07/26/21,Google,77049 GRENADA,1665 Sunset Drive   -,Grenada,MS,38901,1,Shevon Wright,https://maps.google.com/maps?cid=11558034136292118050,Servers were rude food was medicare stood the host station mins and the restaurant was nearly empty staff argued over who would seat The tried congregate the few people there all together had ask can please away give star for the lemonade,--,--,server station restaurant empty staff congregate people lemonade,0.205,0.795,0.0,-0.2023,Negative
07/26/21,Google,85024 PLEASANT HILL RD,2095 Pleasant Hill Rd.   -,Duluth,GA,30096,1,julian randolph,https://maps.google.com/maps?cid=16360772058746374600,Came when was completely dead Waited min just spoken and another just place takeout order don think ever had such terrible experience anywhere Update Waited more min after being told have order taken Employees continued walk past Decided just leave,--,--,dead place order terrible experience update order employee walk leave,0.551,0.449,0.0,-0.8225,Negative
07/26/21,Google,89025 STATEN ISLAND MALL,2655 Richmond Avenue   -,Staten Island,NY,10314,1,Marissa Gonzalez,https://maps.google.com/maps?cid=6176183018748185618,Inappropriate socializing between staff more chilling and socializing than working Rude and disrespectful,--,--,inappropriate staff rude disrespectful,0.5,0.5,0.0,-0.4588,Negative
07/26/21,Google,88097 ST. JOSEPH,4004 Frederick Blvd.   -,St Joseph,MO,64506,1,Sue Martin,https://maps.google.com/maps?cid=5383408047796044730,was horrible Order delivered twice incorrect Slow Hamburger was raw Will not eat there again,--,--,horrible order incorrect slow hamburger raw,0.412,0.588,0.0,-0.5423,Negative
07/26/21,Google,89025 STATEN ISLAND MALL,2655 Richmond Avenue   -,Staten Island,NY,10314,1,Marissa Gonzalez,https://maps.google.com/maps?cid=6176183018748185618,Unsanitary rude and disrespectful staff,--,--,unsanitary rude disrespectful staff,0.5,0.5,0.0,-0.4588,Negative
07/26/21,Google,76072 ATLANTIC TERMINAL,"139 Flatbush Ave., Level 2   -",Brooklyn,NY,11217,1,Donald McLellan,https://maps.google.com/maps?cid=15661427148362500991,Literally the worst burger ever had was very dry and overcooked guessing was made advance recommend not going here surely will not,--,--,bad dry overcooked advance recommend,0.389,0.333,0.278,-0.25,Negative
07/26/21,Google,99079 BED-STUY,1360 Fulton Street   -,Brooklyn,NY,11216,3,Janice Brooks,https://maps.google.com/maps?cid=2721368851208462953,experience this Applebee was not pleasant the other locations visited First was given bit attitude when choosing seating The ladies bathroom that time was horrible The floor was full debris and let not discuss the toilets UGH The server was nonchalant about what the meal consisted just saying not know without offering additional assistance Ordered cheese Mac and Cheese with honey pepper chicken tenders The honey was poured into the Mac and cheese and did not taste good all,--,--,experience pleasant location bit attitude seating lady bathroom time horrible floor full debris toilet ugh additional assistance pepper tender honey taste,0.228,0.652,0.12,-0.4588,Negative
07/26/21,Google,93057 JT BUTLER,5055 J. Turner Butler Blvd   -,Jacksonville,FL,32216,4,Car Guy,https://maps.google.com/maps?cid=9143990540218190663,Good food good service Saved from terrible lunch,--,--,terrible lunch,0.756,0.244,0.0,-0.4767,Negative
